{
  "$schema": "http://json-schema.org/draft-07/schema#",
  "type": "object",
  "properties": {
    "matter_id": {
      "type": "string"
    },
    "jurisdiction": {
      "type": "string"
    },
    "practice_area": {
      "type": "string"
    },
    "corpus": {
      "type": "array",
      "items": {
        "type": "string"
      }
    },
    "facts": {
      "type": "array",
      "items": {
        "type": "string"
      }
    },
    "question": {
      "type": "string"
    },
    "internal_notes": {
      "type": "string"
    }
  },
  "required": [
    "matter_id",
    "question",
    "corpus"
  ]
}